"The time I knocked a deer down - the sight of the animal's á injuries and helplessness.  The realization that the animal was á so badly hurt that it had to be put down, and when the animal á screamed at the moment of death.",disgust
When I saw all the very drunk kids (13-14 years old) in town on á Walpurgis night.,disgust
At a gathering I found myself involuntarily sitting next to two á people who expressed opinions that I considered very low and á discriminating.,disgust
When I found a bristle in the liver paste tube.,disgust
"When one finds out that someone you know is not at all like one á had thought, for instance friends who steal and things like that, á quite unwarranted.",disgust
Friends who torture animals.,disgust
When I nearly walked on a blindworm and then saw it crawl away.,disgust
"A drunkard fell, started bleeding and wet himself.  Disgust that á turned into sadness-unpleasantness.",disgust
When one learns through the mass media all the wars and killing á going on in the world.,disgust
When I had just moved into my new appartment I found a ventilator á in the kitchen.  I was going to clean it when I found that the á drum was full of mud and slime.  I felt disgusted.,disgust
I saw a cripple in rags with small children in Italy.  He was á probably an imposter.,disgust
I found some worms in the food and I had obviously eaten some.,disgust
When an alcoholic stood dribbling over a food counter.,disgust
A bad smelling cucumber.,disgust
It was when I read a newspaper article on the future and they á foresaw that we would be eating frog-burgers by the year 2000.  á An illustration showed a frog between two pieces of bread.,disgust
When someone makes advances that one does not want.,disgust
When a dog is left whining outside a shop.,disgust
While walking in town I noticed how the police harrassed a man á who was under the influence of alcohol.  They terrified him with á the thought of arrest by driving close behind him on a pedestrian á street.  My disgust was directed at the gestures and the facial á expressions of the policemen; they seemed to be enjoying á themselves.,disgust
"At a Sm÷rgasbord table, a man mixed differnet kinds of picked á herrings with fruit salad.",disgust
When I was weeding the garden I found a lizard in my hand.,disgust
"When I saw a picture, in the Gothenburg Post, of a totally á demolished car with two fatally injured passengers.  The car was á so badly damaged that they couldn't get the bodies out at the á scene of the accident.",disgust
Grovelling people.,disgust
"Observing someone in the cafeteria noisily gulping in his food, á having extremely bad manners.",disgust
"I felt some disgust for my boyfriend for a time, after he had á left me.",disgust
Nothing.,disgust
Not applicable.,disgust
"In the tram there was a fat, sickly looking woman in front of me á who was asking for directions in a thick voice.  When she got up to á go a disgusting smell of urine came from her.  I felt that I á would choke.",disgust
"My superior at the summer job swindled customers as much as he á could, and once put me in a difficult situation after which I á could not but detest him.",disgust
"At the underground station, a drunkard came to speak to me.  He á tried to ask me something but I did not answer so he began to á speak about me with his companion.  I detested this dirty á growling man.",disgust
"In the evening, while I was watching TV, my little brother came á in and started eating food he had brought from the kitchen while á I was trying to concentrate on the program.",disgust
"Out of sheer curiosity, I went to see a pornographic movie in á Copenhagen.  The room was full of men, who panted and á masturbated.  Very disgusting.",disgust
[ No response.],disgust
[ Normally I do not feel disgusted.],disgust
Dog dirt which thaws in the spring.,disgust
[ Can not think of any situation.],disgust
[ Can not remember.],disgust
[ No response.],disgust
[ No response.],disgust
If a guy one is not interested in makes advances.,disgust
Someone vomited on the street.,disgust
When I saw a dog which had been knocked down by a car.,disgust
When I was on holiday someone vomited in front of me.,disgust
I was forced to stay in the canteen and eat the food that I had á not asked for but got it anyway.,disgust
"In a warm bus full of people, someone vomited and the whole bus á stank.",disgust
When I read a newspaper article on a young girl who had been á raped and assaulted one night by several men when she was unconscious.,disgust
When I slept with a guy because my best friend wanted me to.  á He had never had intercourse with anyone and had a terrible á complex about it.,disgust
"When a member of the family complains about the food that is á served, it disgusts me.",disgust
"When I was working as a nurse in a mental hospital, a patient ate á up the contents of another patient's spitoon.",disgust
"At a certain person's lack of cleanliness, at home and á personally.",disgust
"My parents attitude towards each other when they should become á reconciled, despite my father's long-time addiction.",disgust
When I was about to clean the draining board and saw it looked á underneath the sink (I live in a students hostel).,disgust
A mother who shouts at her child for nothing.,disgust
When I saw a big spider from very close.,disgust
The first time that I saw a surgeon cut off a leg and put it in a á black rubbish bag.,disgust
T.V features showing the violation of defenceless people.,disgust
Spit and vomit.,disgust
"A study visit to a chicken factory : the butchery, the smell, á the environment and the noise.",disgust
When programmes on violence or pornography are shown on T.V.,disgust
A film were a woman was attacked and raped.  One did not see the á worst but it had the desired effect - very strong.,disgust
When my cat vomited and a worm came out which was still alive.  I á was forced to wipe it up.,disgust
"Disgust is a feeling that I have never experienced with peoplie á but , on the other hand, it has been with repulsive animals, i;e á snakes on T.V.",disgust
At the police centre a man between 40-50 was brought in.  He was á very drunk and in all likelihood had not slept indoors for a long á time and had relieved himself in his trousers.,disgust
"I had some sort of a stomach virus last week and  I vomited in á college in the morning, then in the cake shop, three times during á the trip home and again when I got home.",disgust
When I think now about the way my father behaved when filing a á divorce.,disgust
When I tried to explain to my child as to why there were á magazines wiith naked girls on them at the kiosk.,disgust
When I saw a T.V programme on animals in the film world á (mistreated and used).,disgust
When I read racist slogans on the walls.,disgust
"When I was an auxiliary nurse at the hospital and I had to change á the nappies, for the first time, of a very old and sick woman.",disgust
"When I woke up one morning and went to the kitchen I discovered á that our dog had diarrhoea.  There were small \piles\"" all over á",disgust
The lift of Stockholm central station stank of vomit and urine.,disgust
I was dominated by a certain person and even though I knew it I á could not change my own reactions.,disgust
A friend unjustly put the blame on me to relieve his conscience á and also spread lies for the same purpose.,disgust
When I discovered that the house we had hired in Tonga was full á of cockroaches.,disgust
[ No response.],disgust
[ No response.],disgust
[ No response.],disgust
[ No response.],disgust
[ No response.],disgust
 The smell of garlic in rush-hour bus.,disgust
I happened to see the video-tape movie \This is America - Part á,disgust
"During the week-end at home, my mother fries greasy and unhealthy á meat dishes which make me feel sick.",disgust
"When I went home by train from Sicilia, I was molested by a man.",disgust
"A friend's boy-friend treated her very badly, let her serve him, á provoked her and just utilized her.",disgust
It was in a tramway-carriage: A stranger insulted a girl just á because she blew her nose. I detested his behaviour.,disgust
I came across a group of people with the same basic ideas/beliefs á who were all fighting and going against what they would say was á good.,disgust
During a movie in which I saw the effect of white settlers in á Africa.,disgust
"At what I was capable of of selfishly using others for sexual á encounters, while I held a vision of having a deepening á above-board (you know, \girl next door\"") devotion to a girl in my á",disgust
I work part-time as a shop-assistant and a customer spoke to me á very loudly about an Indian man & white woman with children - how á horrible that was and would I want to have little dark children.,disgust
"Coming home one night - my sister was home, and had been drinking á heavily and started picking arguments.",disgust
When I saw all the starving people in Ethiopia on T.V.  It felt á awful to see such suffering.,disgust
[ No response.],disgust
When my uncle comes (3 times a year) for the traditional á Christmas dinner with my grandparents and other relatives and is á very drunk.,disgust
"Very intoxicated men who incite each other to fight.   I met a á vile smelling man on the tram who got closer and closer to me á till I got up, then he got angry.",disgust
I worked in a harbour and emptied latrine containers from the á back of the lorries.,disgust
When I was a young teenager (14)  my brother-in-law to be had á made heavy advances to me.  I did not understand very well what á it was all about but I reacted strongly and the feelings are á still there.,disgust
I had intercourse with someone and then I realized that what I á had done was wrong and it disgusted me.,disgust
Helping older people on the toilet.,disgust
I was present when they found a shop-keeper dead in his shop.  á He had been shot with a shotgun at close range.,disgust
"When I was touring Asia with my present football team, I saw old á Europeans with young asiatic prostitutes.",disgust
"With my mouth full of bun, I drank directly from a packet of milk á which turned out to be weeks old (completely separated).  It took á a while for the milk to seep through the bun.",disgust
[ No response.],disgust
"At an anti-pornography meeting, when samples from films and á magazines were shown.",disgust
NO RESPONSE.,disgust
My boss on the job failed to keep his promise about something he á knew was extremely important to me.,disgust
When my mother's new husband treated her and my brothers and á sisters badly.,disgust
Slaughtering of animals.,disgust
Can't describe any disgust situation.,disgust
When I learned that a relative had been spreading rumours about á me.,disgust
"There is a certain person, whom I only have seen. He makes me á cringe, feel disgust.",disgust
"Was confronted with a person having negative thoughts of other á people because of their social status, beliefs, color and á outlook on life (perspective).",disgust
In a public swimming hall I saw a very aggressive man who á practically attacked the children who got in his way when he was á swimming.,disgust
"This is difficult, since I don't remember feeling disgust towards á anyone.",disgust
The murder of two girls on a school trip to Berlin (and sexual á crimes generally) a couple of years ago.,disgust
"Some people were unfairly treated, because of their á nationality/colour.",disgust
Close friends talking badly of other friends.,disgust
"Political and military trnsgressions around the world, generally á speaking. This cannot be described through this questionaire.",disgust
Doesn't apply.,disgust
Can't remember having had this feeling.,disgust
"Having been unjustly punished, I feel disgust towards the person á responsible.",disgust
"Reading about executions and massacres which happened during á World War II, I felt disgust towards those who did it.",disgust
When people manipulate others through appearing better than what á they really are.,disgust
"Quarreling with my father, when he made false assertions.",disgust
Can't remember any episode of disgust.,disgust
"Outside a night club, a grown man was sitting on top of a younger á woman, beating her up.",disgust
Can't remember any such feelings now.,disgust
The sadistinc exacution of a student in the USA.,disgust
Seeing a pornographic film when looking for a place to live.,disgust
Maltreatment of children.,disgust
I feel disgust towards those who are responsible for the death of á others.,disgust
Overeating a traditional type of food - blood pudding.,disgust
Does not apply.,disgust
"A teacher gave me lower grades than I was entitled to, and was á hoping for.",disgust
"When a \friend\"" dropped a frog down my neck, and I didn't know á",disgust
"I had a discussion with my wife about an over-weight acquaintance of á our's, about her eating habits and the scars caused by her á pregnancy.",disgust
A saturday night a bus full of drunken people.,disgust
"As a child, when I saw an \unesthetic\"" sight.""",disgust
We were at a hamburger bar and a man at a table nearby started á coughing and spitting into his plate.,disgust
"On Reperbahn, in a restaurant, a \charming\"" old saleswoman came á",disgust
"In the army, an acquaintance of mine tended to use his position á to advance his own interests.",disgust
When I saw hundreds of snakes twisting over one another in a á movie.,disgust
A rich man expressing disgust towards an alcoholic.,disgust
In the bus I was sitting next to a colleage who was drunk and á behaved in keeping with his state.,disgust
A too eager approach by a dirty drunken person in a bus.,disgust
When I noticed that a nice person was being exploited á economically.,disgust
"At my grandmother's detestable and selfish conduct towards my á elder sister, although her behavior was due to senility and lack of á understanding.",disgust
"Spoilt, smashed and molded potatoes in the fridge, and having to á clean up the dish later.",disgust
My parents inherited an appartment and this made them behave in a á peculiar manner.,disgust
I felt disgusted at the environment while getting back to my á student lodging. I did not see anything in the suburb which had á been planned by taking people's comfort into account.,disgust
"In the army, I had been in hospital for two weeks and as soon as á I returned to the company, a sergeant ordered me to fetch a load á on the tractor trailer.",disgust
"I was travelling in a local train when a drunkard, smelling á terribly, entered the same carriage and started eating fish that á was stinking.",disgust
When an untidy and heavyly drunk person made endeavours to á approach me.,disgust
When a friend of mine got drunk and started to blame and scorn my á other friends and me.,disgust
The male friend of my mother (a widow) moved in to live with us.  á I did not like the man.,disgust
"A series about Freud was shown on TV.  In it, a tampon had been á set in the nose of a woman, and forgotten there.  After great á pain it was taken off (close-up picture), the woman was bleeding á from the nose and the mouth.",disgust
[ The same as in anger.],disgust
Watching a violent movie.,disgust
"When an acquaintance of mine told me about the way his parents á treated their sons in an unequal manner.  The most successful of á them got continuous encouragement, and the youngest was not á encouraged and was rejected.",disgust
"In a film, there was an episode where they used a chain saw to á cut a man.  I could not look at it, but I could not avoid á listening either.  I sought shelter in my boyfriend's arms.",disgust
"When an acquaintance (he was drunk) of my room-mate vomitted on the kitchen á carpet.  It was past mid-night and my room-mate had just moved in, á this acquaintance had helped her move in.á ",disgust
"When an unpleasant person tried to make friends with me.  A á subtle, small, insignificant, grey being whose helplessness and á neutrality evoked the feeling of disgust in me.",disgust
A friend of mine came to see me when he was quite drunk.,disgust
"I detested my father who was a drunkard.  He would rave, á threaten and blame my mother and me.  He finally drove us away á from home.",disgust
"When I was watching a movie with many violent episodes.  They á accurately showed the cutting of corpses, etc...",disgust
"My life-partner is going through a crisis (way of life, old-fashioned values) á and can only get out of it by talking bold decisions.  I have á noticed his cowardice and attempts to escape his problems by á drinking.  I detest his drinking and his being full of self-pity.",disgust
A man spat on the wall of a house.,disgust
"While reading Olli Jalonen's new book, the distant, cold and á selfish relationships between people (in the book) made me feel á disgusted.",disgust
A very drunk person.,disgust
[ When some people act very important in any situation.],disgust
My mother called me because she had read through the enveloppe a letter á addressed to me.  She denied having read it intentionally and á said \the words just popped out through the enveloppe as the sun á,disgust
"On a trip abroad, a lady-like member of our group turned out to á be an alcoholic.  She spoilt many days of my holidays because of á her behaviour and paranoia.",disgust
"While watching the movie called \Deer hunter\"" on TV, when it á",disgust
"When I heard about the advances an acquaintance of mine had made á to my friends, who did not approve of them.",disgust
"A nightmare.  I was dreaming about bloodsuckers, which I tried to á shake off from my body, they are everywhere, they get glued, they á suck.  And there are a lot of them.  I panic.",disgust
"While walking on the street with a good friend of mine, we met an á acquaintance of hers.  My friend started showing off and telling á false stories about herself and praising herself.",disgust
"After the first of May, I detested my fiance's friends, who had á piled on to our party and spoilt it completely.",disgust
When I saw a spider.,disgust
"Once again, my life partner came back home drunk at midnight.",disgust
"In the morning, the cat of my landlady had vomited on the floor, á near the staircase I take to go to the bathroom.",disgust
"At school, I detested the spinach gruel which had lumps of flour á in it.",disgust
When I noticed two spiders running on the floor in different á directions.,disgust
The disgust I feel towards a certain person.,disgust
"A man tried to have sexual intercourse with me, though I had á communicated my unwillingness.  Later on, I felt disgust at that á person as well as myself because I had partly submitted.",disgust
"In a lift a drunken, fat and untidy man tried to make advances at á me.",disgust
"When I was working, I got treated in a way which I felt was not á democratic.",disgust
"I happened to see two boys fighting, one of them fell down and á hurt his head.  The other one used this to spank the head of the  boy on the ground.",disgust
"I once watched the series called \Dynasty\"" on TV, and I detested á",disgust
One of my fellow students used questionable and unfair means to á advance her studies faster than others.  I detested her.,disgust
"While travelling in a bus, there were three people sitting behind á me (two men and a woman).  They were drunk and the conversation á was unbelievable (about fucking, fellatio, etc...).  They tried á to get others to take part in the conversation.  I loathed it and á felt like crying.",disgust
"I was on my way home by bus.  A man who had drunk a fair amount of á alcohol started talking, trying to hug and pat a woman sitting á next to him.  Fortunately it was not me.",disgust
"I heard somebody talk about studies in a highly enthusiastic á \student-like\"" way.""",disgust
The behaviour of a fellow towards me and some others in the army á was really mean.  I detested this.,disgust
"Yesterday in the elevator a man started smoking, this is á something I just can not tolerate.",disgust
"I saw a movie called \The Thing\"", the film directed by John á",disgust
When I saw our computer teacher.,disgust
"When I was still a child, I saw a horror film on TV in which á there was a rotten human skull.",disgust
"Father said: If you are pregnant, you will have to procure á abortion. I was filled with disgust against my father.",disgust
A gigantic spider climbed over my face and what is more - in my á own flat.,disgust
"Scuffle in a carriage of the underground in Vienna, three drunk á men thrashed a man in a wheel chair - I watched the scene from á another carriage.",disgust
"Eco-activists demonstrated against a project to build a power station á at the Danube in the middle of a lowland forest (Hainburg) and á the government decided to delay it for another year. When my á father heard about it, he said that we needed another Hitler.",disgust
In broad daylight I saw an untidy old man pissing and playing á with his penis in the middle of the town.,disgust
I read a book about the sexual phantasies of women; I read about á a woman having sexual intercourse with a dog.,disgust
When I entered the dissecting room for the first time. I think I á felt disgusted mainly because of the bad smell of formaline.,disgust
"Old man in hospital, hollow-cheeked, only one half of his nose á and glass-eye, rattling breath.",disgust
"Several weeks ago, I had problems with friends, I felt disgusted á by a friend.",disgust
"On a trip I passed by a cellulose factory. It was a fine day, á beautiful landscape; I observed this factory with disgust.",disgust
In a certain book I read about cruelties and violence in prison á and souteneur circles; I felt especially disgusted when I read á detailed descriptions of physical and mental torture of less á powerful people.,disgust
A friend prepared a soup with chicken heads and invited me to eat á it. I saw the eyes staring at me and the tongues hanging out of á the bills. I was so disgusted that I felt nausea and had to leave á the room.,disgust
A drunken man forced me to kiss him.,disgust
A friend told me how he managed to win the sympathy of as many á people as possible. He said he first listened to what they said á and then he tried to only say things they would like to hear. á He would never express his own opinion. I felt really disgusted á when he told that.,disgust
"When I stayed in the house of friends, I washed my face and á wanted to dry it with a towel. This towel seemed to have been á used over a long time already. It smelled indefinably awful.",disgust
"In school I had difficulties mith mathematics. When I had to work á for an examination, I really felt disgusted.",disgust
I saw a physically handicapped young man whose spittle ran out of á his mouth while speaking.,disgust
"During a football game, another player who was perspiring very á strongly ran into me.",disgust
"I read a book about the situation in South-Africa, about the á terrible violations of human rights. I was disgusted with the á white population.",disgust
"A drunk man attacked his wife and wanted to humiliate her by á insulting her. Then he turned violent and started to beat her in á front of her child. She left it happen without saying a word in á order not to make things worse. I watched the scene and tried to á calm the man, but without success. Just because he was stronger á we had to comply. From that day I detested him.",disgust
"I watched the news at the TV, it was a commentary about á \Hainburg\"". I felt disgusted when I heard members of the union á",disgust
A friend was assaulted by a young man on her way home.,disgust
At school a classmate who was a very good pupil had to help á another boy who performed less well. He told him on purpose the á wrong things so that he had to repeat a year.,disgust
When I was younger I often saw my father come home drunk (he had á big problems at that time). Once he woke me up in the middle of á the night and shouted at me.,disgust
"One day, when I was twelve years old, my brother took some slimy á substance swimming on the surface of a pot of vinegar made of á cider and threatened to throw it at me.",disgust
When I listened to a conversation of friends talking about the á power of money.,disgust
I read about a monk who had been murdered and put into a barrel á which was filled with blood of pigs.,disgust
"At a discussion a friend took a \faschistic view\"", what I had not á",disgust
Some time ago a girl tried to make me up without any action of my á part. She used all possible means. Although I behaved refusingly á she did not give up for a longer time.,disgust
When a boy had continued to use foul language and swearing in á front of a group of my friends.,disgust
"No very strong such emotion. Treatment of my sister by her á dancing instructor - he is a \user\"", i.e., takes advantage of her á",disgust
On boat trip - saw mother giving young child (aprox 6-7 years) á cigarettes.,disgust
People spitting in railway stations.,disgust
"I assisted to a scene where the police attacked a person that á didn't have his documents. The savagery was too much, and the á attacked person bleeded to much.",disgust
"The acts of brutal violence in generally disgusts me. Fights, á phisical aggrssion, etc.",disgust
In a sexual experience with an unknown woman where after the á sexual act I only could go away without looking backwards.,disgust
"When I saw a woman subjugated by money and not being able to hide á how she hated herself for not having the will power to get out of á such a situation because it was convenient, according to what she á told me.",disgust
My brother caught a spider and let his frog eat it.,disgust
I have a horror of spiders and snakes. On a walk through the wood á I saw the body of a slow-worm (without the head).,disgust
