"I detest any kind of constraint and hate the attempts of elder á people to force me to a norm of behavior without having legal or á moral rights to do it. I felt this emotion when a neighbour of á mine made me kick out my guests because they had talked very á loudly and threatened that with \connections\"" she will expel me á",disgust
The event which got me angry got also an aversion in me.,disgust
"I became disgusted with the man on whom I had counted, who I had á trusted, the man who should have been my mainstay - my father. á I could hardly make myself (and the others) believe in this á emotion. It has cumulated after events and deeds. Everything can á happen in this world.",disgust
"For a drunk man (about 20 years old) that I met one evening, and á who behaved impudently with the girls standing by.",disgust
I got disgusted with a man who was beating a woman in the street. á I just happened to be there but I was abhorred by the rudness.,disgust
Deception from a person I loved very much.,disgust
I felt it today when the bus driver shouted rather indecent words á at a man without any reason whatsoever.,disgust
"Some time ago I was disgusted with the \cleanness\"" of the á",disgust
"It was at a comsomol(??) meeting, the last one because we were to á graduate. The way one of my fellow-students behaved made me feel á disgusted.",disgust
I felt disgusted about a teacher who had rejected all that was á human in her. She refused to accept the flowers we gave her for á the eighth of March and asked for a foreign parfume instead.,disgust
I hate hypocrisy. My friend (girl) tried to intrude into my á affairs with my future husband. After that she behaved as if á nothing had happened.,disgust
I am disgusted with the behavior of a car driver whose car would á run over me and my friends during our autumn brigade.,disgust
I am disgusted with a nieghbour who is looking for all sorts of á quarrel with my parents and me. He feels we are hampering his á living close to us. This has been going on for quite a long time.,disgust
"I feel disgusted with the bootlickers, with helpless people.",disgust
"In autumn I had to move to another lodging. My landlords, quite á intelligent people, warned me I had to move in the nearest á future. But I had difficulties in moving my luggage because I á couldn't wait for a car to come. How amazed I was to hear them á threatening me they would throw our my things. And at that my á luggage was well packed and did not stand in their way. I was á quite  disappointed and disgusted.",disgust
When I see the acts and deeds of a blind drunk man.,disgust
I had a very good friend (boy) and I thought I could rely on him á but he behaved badly with a girl who used to trust us completely.,disgust
I felt disgust with alcohol in general when a close friend of á mine got so drunk that he didn't realize what he was doing and it á was quite shameful.,disgust
"I felt disgust with a lady teacher who used to nag, to mock, to á interrupt everyone of my fellow students each time we had a class á with her in our first year.",disgust
I feel disgust with my first boyfriend who made fun of our love á in an abominable way.,disgust
With an alcoholic.,disgust
During a summer holiday at a bar I happened to see a dead to the á world woman.,disgust
"Many times, when my father used to come home drunk and maltreated á physically me and my mother.",disgust
"Disgust for a person who treated me badly, and has treated other á people similarly - including lying, hiding facts, being á deceitful, unfair, etc.",disgust
With a woman who had walked into my place of employment and á urinated on the floor in front of everyone.,disgust
"I was disgusted by my paranoid attitude towards myself, my á homework at university and disgusted about my lack of retention. á Especially in learning another language.",disgust
"People who came to our home - and requested \Put out your smoke\"". á",disgust
A sour looking man was beating his thin dog in Remuera.,disgust
When the N.Z. rugby union announced that they would proceed with á a rugby tour of South Africa.,disgust
"A gathering of a social sports club at which they proceeded to á show pornographic videos and then afterwards (when most people á had had quite a bit to drink) carried on in a very degrading, á unmoral manner - especially females exposing and flaunting á themselves with no shame or embarassment.",disgust
A friend of mine goes out with this guy. She sleeps with him but á is quite happy for him to play around - as well as herself.,disgust
My brother gave me a beating because he could not beat me á verbally.,disgust
I'm very disgusted when I see people abusing their body with á drugs and alcohol. They take advantage of these things usually á for an excuse for the fantasies which they like and so they do á things stupidly and unjustly.,disgust
"Disgusted with boyfriend's mother - her overpowering, á over-protecting and selfish attitudes.",disgust
A child told me she had been sexually abused by her step-father. á I only knew the child and had not come into contact with either á parent. I tried to do what was best for the child. The event and á the stepfather disgusted me.,disgust
When a man spoke very sexistly in the company of some friends of á mine.,disgust
With the N.Z. Rugby Union wanting to send the All Blacks to South á Africa.,disgust
Having moved into a flat within the last week I felt some disgust á that a bathroom tap had been left to drip with a faulty fawcet.,disgust
When a close friend wilfully cheated me.,disgust
Finding that a girlfriend of mine was a prostitute and had been á seeing many others during our relationship.,disgust
When someone I had had a relationship (purely sexual) with came á up to me after I had used her and acted as if nothing had á changed.,disgust
A close friend took part in a racist violent action.,disgust
I get disgusted with the inherent racist attitudes of my á brother-in-law in putting down various ethnic groups and also my á unwillingness to challenge him about these attitudes in order to á keep the peace.,disgust
Hearing Norman Jones get hysterical in Parliament about law á reform (on the radio - listening with 2 others).,disgust
Reading literature on AIDS/homosexuality.,disgust
My older sister used to pick on my brothers and sisters all of á whom were younger than her. On one occasion my brother did á something my sister didn't like. A full-scale battle began.,disgust
Our boarder burping after meals !,disgust
When somebody who had been a bully and had acted cruelly to á others who were unable to defend themselves was taken down a few á notches and he began to grovel. I was disgusted with his á grovelling and the manner in which he had treated others.,disgust
"Next door nieghbour ran over his cat in driveway, he tried to á finish it off with a flat shovel. I would have taken cat to á veterinary to either kill humanely or cure.",disgust
Noticing my flat had maggotts !,disgust
"When someone whom I considered my friend, without telling me he á was annoyed, proceeded to ignore me for several meets with no á apparent reason.",disgust
With a Manager who insists on making crude innuendos pertaining á to sex.,disgust
"Prolonged \niggling\"" of friend on a single theme which I á",disgust
Watching an alcoholic woman who was approaching everyone at the á wharf for cigarettes - a prostitute in Auckland (elderly).,disgust
"I was driving along and saw this young guy urinating into the á gutter, in broad daylight.",disgust
Obscene phone calls.,disgust
When employer made a pass at me whilst I was at work.,disgust
Observation of people lost in the profit motive - i.e. business á managers to their actions esp.,disgust
Having unwanted attention paid to me in my place of work - á harrassment (and sexual harrassment) by another worker - á disgusted by his implications.,disgust
At a party my best girlfriend got really drunk and went off with á a guy she knows I really like.,disgust
I once saw a programme on TV describing how certain wild life á films were made and was disgusted by the treatment of certain á animals in this particular programme of the polar bear.,disgust
When reading a newspaper story of a man who had committed á incestuous acts on his two-year old child - the thought that á anyone could do such a thing is abhorrent to me.,disgust
"I once saw an old man up the road, fossicking through the rubbish á bins and the gutter. I was really disgusted at first but I've á seen him a few times since then and now I feel really sorry for á him and I often give him cigarettes when I see him, because he á mainly goes after cigarette butts and it is revolting.",disgust
A boyfriend with whom I split up with came over to a friend's á house where I was visiting with a male friend. In a confrontation á in another room he tried to find out if I was aroused by my á friend by feeling my parts.,disgust
When a close relative got quite drunk. It was a relative that I á had respected for a long time and looked up to as a child.,disgust
"The repression of rioting and non-rioting \Blacks\"" in South á",disgust
My flatmate and close friend living and sleeping with another á close friend of mine.,disgust
Friends calling me fat - pear shaped in front of a nice girl.,disgust
A drunk walked out in front of a car at night. Both lower legs á were broken. His shoe was thrown about 50 yards after the á accident.,disgust
Flicking through a magazine showing pictures of homosexual men á committing various acts.,disgust
"I deliberately avoided a person who I wanted to hurt, and who á wanted to talk to me.",disgust
One of my very good friends came to me for advice as her á boyfriend had been hitting her and beating her quite harmfully.,disgust
I read a newspaper article about dogs being stolen in order to á use them for fighting purposes.,disgust
Watching a TV documentary on seal clubbing.,disgust
When I first saw the state of a cafeteria in the grounds of the á university. Due to students own lack of concern for the á environment in which they eat and drink. Rubbish and spilled tea á and coffee left everywhere.,disgust
When I heard about the disaster in Bophal (India).,disgust
A piece of work was marked as bad by the teachers I and some á fellow students didn't agree with their vague criticism. I felt á myself taken in by the teachers and felt disgust.,disgust
A person I know who tells lies and so pretending to be better á than she is.,disgust
I was once raped (one year ago) by a man who was a lot older than á me and whom I just met. Maybe it wasn't rape but the man wanted á more than I wanted to give him since there were other people in á vicinity.,disgust
"When I was in Eindhoven on an Exhibition of Hernan Nitsche, who á made paintings with real blood. There were also photographs about á the killing of cows.",disgust
A few days ago I saw two dandy girls of my age. I disliked their á clothes and their way of doing.,disgust
"When I had to eat scraps from a dust-bin, because of a bet.",disgust
When I entered a toilet in a bar and it stank.,disgust
"One day I was in the countryside with several friends, and we á began to eat figs, after we were all full we noticed that all the á figs were full of worms.",disgust
I saw the gare of a prison.  This gare and the building were in á deplorable condition and were full of rubbish.,disgust
"On a trip to Santander a child sitting beside me fell ill and á started to vomit, seeing this made me feel very bad.",disgust
When I heard about the treatment of a friend in jail. Really á inhuman. I never realised that such things also happen in the á Netherlands.,disgust
"I was shopping in Utrecht with friends, we also ate some chips á and snacks in a snackbar, then we saw a shabby fellow. He took a á cold half eaten croquette (a snack) from a rubbish bin and eat á it.",disgust
"When I watched TV and saw a performance of \Prince\"" (a popidol). á",disgust
"Being on view in a meat-factory. Pigs being cut open, pigs being á suspended from nods, blood everywhere, decompsition.",disgust
"When working in a chemical laundry, I saw rats and maggots in the á washing.",disgust
I lived together with my boyfriend. One night he stayed away and á next day he told me that he had chat up with another girl.,disgust
Each time I am confronted with reports about repression and á torture.,disgust
"I broke an egg, with which there was something wrong, into a á little cup. There was a thick white \wad\"" in it. I tried to take á",disgust
"On school, during a fancy fair, there was a stand of amnesty á international. There I read (for the first time) a description of á the tortures of a woman, what they did to her.",disgust
"A friend and a girlfriend went to Rome for 10 days with their á class. When they were back home I heard people tell \strange\"" á",disgust
When I take a look into a slaughter-house and when listening to á stories about torturing people or animals.,disgust
When I saw a documentary film about World War II (about Hitler á and his adepts).,disgust
I wanted to take something from under my bed. While doing this I á felt a dead bird laying under my bed.,disgust
"Salo, a movie film by Pasolini. People were misused and tortured á for the fun of a few elder Italian authorities, during World War á II.",disgust
"In a disco, there was a dirty little chap who punched my bottom.",disgust
Seeing someone who has bleeding nose.,disgust
I read a book about torture. The book described exactly how the á torturing was done.,disgust
A fellow student who seemed very nice later on proved to be a á slimy fellow towards a professor.,disgust
"Bisshop Ter Schure intoduced himself on TV to the Dutch Nation. á He spoke as if he was God himself, and didn't discuss the way he á had achieved this position.",disgust
"When I read about or think about environmental pollution, the á armor race, starvation, etc. Then one realizes that mankind is á bad, most important is power and money, at the cost of nature and á mankind.",disgust
"It is very difficult to relate it to a certain event. I am á familiar with the disgust of Sartre (la nausTe), a frequently á occurring cause may be described as \the self-assured dullness\"".""",disgust
"When a girl in my class (on the secondary school) appeased the á teacher, resulting in getting a higher grade. This occurred often á with her.",disgust
"Grandfather lives in a home for the elderly. He always looks á forward to visits. On his birthday (by coincidence it was on á \Mummy's day\"") however, nobody went to see him. Is the own family á",disgust
When my friend who was drunk insulted me in public for no reason at á all.,disgust
When I learnt that my best friend had failed the exams.,disgust
"I found out accidentaly that while my uncle was away in Canada, my á aunt had been bedding a young man on a regular basis.",disgust
A person whom I thought to be honest took and spend the little á money that I had and I had no way of getting any money in the á few following months.,disgust
When my sister's boyfriend accused her of having been sleeping around.,disgust
People who discriminate other people disgust me.,disgust
"Seeing maltreated, dead animals.",disgust
During my birthday party a friend drank too much alcohol. So much á that he had to throw up. Worst of all was that he couldn't leave á my friend alone and that he was molesting her.,disgust
During military service I heard the story of someone who tried to á commit suicide and as a result of this got a week custody.,disgust
I heard a broadcasting programme about parapsychology. The people á in this programme used very difficult words which I couldn't á understand. They acted exaggerated without showing any feeling.,disgust
A student who lives in the same house where I live is an alcoholic. He á tries to manipulate other people with his money when he has drunk á too much.,disgust
The stories about my aunt who was beaten and humiliated by my á uncle.,disgust
There is a person whom I disgust. Evrey time I see her I get this á terrible feeling I disgust her whole appearance.,disgust
A story I heard recently about a baby dying after sexual á abuse.,disgust
"When my parents behave very \witty\"" towards me, they make insipid á",disgust
"Every time I meet a certain person. We cannot get on well á together, we dislike each other.",disgust
"A friend had a quarrel with the mother of her boyfriend because á she and her friend decided to go and live together. She needed á money for removal, then she made a great effort to reconcile.",disgust
I saw a terrible accident in which the driver of a motor was á thrown through the frontwindow of a car. His face was completely á away.,disgust
A teacher was very blunt in his relation to a child so that the á child was very upset when arriving at home.,disgust
When an uncle of mine who is very ill started to cough wich á sounded very dirty. (He can't help it of course).,disgust
My father is someone I disgust. So when he comes close to me á a feeling of disgust overwhelms me. When I stay a week-end at my á parent's place I will remember it for long time.,disgust
I was looking at a one-man show on television. He told very á disgusting things so that I started to be disgusted with it. á (Later on it proved that this was his intention).,disgust
After the accident which I described in SHAME. I came to myself á and saw how terrible everything looked like. I disgusted myself á and everything I saw.,disgust
I heard part of a conversation in which one talked very low about á women.,disgust
I felt disgust after watching a picture on television about á torturing political prisoners in India (this happened in the á India of Indira Ghandi).,disgust
I feel disgust when hearing or seeing other people being treated á inhumanely. For example torturing in chili.,disgust
A girl who also hires a room in the house where I live always á tries to make a quarrel with everyone available she disgusts me.,disgust
When I ate a rotten apple.,disgust
I read a story in the newspaper about butchers treating their á animals very badly. They disgusted me.,disgust
I saw a dog who was eating excrements.,disgust
Seeing a pornographic movie in which animals were used.,disgust
I was hitch-hiking when a man stopped and gave me a lift to á Nijmegen. During the ride he asked me whether I was in for fun. á The man was fat and tatooed.,disgust
When once again I drank too much and felt very rotten the morning á after.,disgust
When I had to finish those big amounts of homework in time.,disgust
"A scene in a film in which one man repressed another one. By á concidence, their position was reversed. The other man was á repressed in an identical way as he did before.",disgust
One night I saw a man being knocked down by two other men. The á victim was kicked against his head.,disgust
"Someone told me a story of Amnesty International: a boy was á killed and his head was put in the litter of his girlfriend. It á looked as if she was pregnant, then she died. It is disgusting, I á can hardly write it down.",disgust
"When people are eating unsavoury (smacking, belching, speaking á with food in their mouth, etc.).",disgust
When I made love with someone who I didn't really love. Sometimes á I even considered him unlikable.,disgust
I read a newspaper report that a little boy was forced to look á while his sister was raped.,disgust
I cannot remember exactly such a situation. But I know that á once I went to a very dirty lavatory and that disgusted me.,disgust
My mother was very angry with my little sister and told her to á put her hands on the table in order to beat her hands up. She á forced by means of her power.,disgust
"When I see that some people remain cold and egoistic with regard á to close friends, even in situations that those friends need á them.",disgust
"A few days after I had finished the relationship with my á boyfriend, we had a quarrel. Then he hit me. At that moment I á found him disgusting.",disgust
When I saw someone eating live worms.,disgust
When I see rotten meat.,disgust
"I had a class-mate who was rather stupid.  I did not like him á but I respected him.  When he tried to talk to someone, they á would not listen to him and I could not bear seeing this.",disgust
When I am dirty because I have not had a shower for a few days.,disgust
I had to change a baby's clothes for the first time.,disgust
When I saw a scene on T.V where a castration was shown.,disgust
When a very dirty class-mate farted in my  presence.  There was a á terrible smell.,disgust
On seeing a scene of an accident in a magazine.,disgust
Whenever I see an alcoholic.,disgust
When I got to know the details if the famine in East Africa.,disgust
"When I was a child, one day while playing, I fell up to my waist á in mud.",disgust
When I see people who have no sentiments.,disgust
A young man was insulting and humiliating a drunken man.,disgust
When I saw a film where a black was rapeing a girl while another one was á filming it for a pornographic movie.,disgust
"Some people whom I do not like at all, and one of the reasons is á their physical appearance.",disgust
Pictures of Nazi extermination camps on a T.V program.,disgust
When I see dead dogs on the road.,disgust
When I saw a very disagreable scene.,disgust
When I saw an accident where the man lost his head.,disgust
When a person saw that I was accused of something I had not done á and did not do anything to defend me.,disgust
When I had to dissect a live mouse at school.,disgust
When I saw several people washing their car with water from a á drain.,disgust
"One day I was going through the street door of my house, when a á man asked me for a doctor.  He then showed me his genitals and á asked me to cure him myself.",disgust
"When after a storm in the country, I left my shelter and saw a á big, fat, slimy green toad by my side.",disgust
When I see pornographic films.,disgust
On the road there was a dead animal with its entrails showing and á its skull crushed.,disgust
I was in the cafeteria at the university and a class-mate told me á that a friend of hers had had all her teeth taken out because of á an infection caused by her eating a rat's nail in her hamburger.,disgust
The sight of vomit on the street.,disgust
To loose friends because of them over-estimating themselves.,disgust
The man who threw me out of the flat disgusted me.,disgust
I read a book whose plot and expressions were obscene and in very á bad taste.,disgust
I saw in an ice-cream kiosque a cockroach walking through a á cornet.,disgust
A TV program on whale-hunting.,disgust
Some friends and I were having lunch.  Someone said something á funny and one of the guys started laughing and spat his food in a girl's á face.,disgust
When I see someone vomitting.,disgust
"During lunch with some classmates, a priest was also there.  He á was eating desperately as if someone was going to take his plate á away.  He did it with gluttony.  He wiped his hands on his suit á several times and it was full of crumbs.",disgust
They asked me to throw the rubbish into a dustbin which had some á awful liquid accumulated at the bottom.,disgust
Once I had to clean a lavatory which was obstructed.  It was in a á friend's country house and there was nobody there to help me.,disgust
One day I went to see a rather disagreeable film (X).,disgust
"When I had to sleep in a bed at a hostel, which was full of dirt.",disgust
"A situation of overt unfairness, manipulation of people and its á consequences.",disgust
When I was reading a book.  It had nothing to do with the book á itself but with the disagreable smell of the pages of the book.,disgust
"The first time I saw a pornographic film, all that in practice is á so beautiful but on the screen appered as something mechanical, á irrational, disgusting and dehumanizing.",disgust
"My dog had been run over and died near the house.  We had to pick á him up, cold and glassy eyed, to get rid of the corpse.",disgust
I was at the table at a French friend's house.  They served me a á big dish with roast cauliflower and sauce.  I had to eat it. ,disgust
When I entered a brothel and saw two sailors with a young á prostitute who was not older than 18.,disgust
I saw some images of a decapitation in a horror film.,disgust
In a bus I fell sick and vomitted in a bag.  The entire situation á was disgusting in itself.,disgust
I visited a place in Morocco where they worked the leather.  I á saw the skins emerged in a liquid which ressembled putrification.,disgust
When I saw a film in which the man suffered from an illness and    á his skin came peeling off.,disgust
The physical appearance of a meal.,disgust
"When I was young, one day in the car we fell sick and ended up á vomitting on each other.",disgust
I saw a program on T.V where they had to saw a skull for an        á operation.,disgust
Seeing a film in which there were several bloody crimes.,disgust
"I found a big, black spider near a bag of food.",disgust
I had to wash my grandmother because she did not get to the á bathroom on time.,disgust
When I was walking in a field which had a lot of manure.,disgust
Finding a hair in the soup.,disgust
"Ever since I have been a child, the sight of any kind of wound.",disgust
There was a cat on the street.  It had been run over and its head was á open.  We passed beside it.,disgust
I was drinking coffee in a cafe and I found a piece of scrubber á in my cup.,disgust
"In a film there was a scene in which a rat was sliding on a bed, á leaving a trace of blood behind, finally it entered the mouth of á one of the actors.",disgust
I saw a sort of black worm being attacked by many ants.,disgust
"I found a cockroach crushed between two folders in my bedroom, I á called my mother.",disgust
