One day my colleague misbehaved with me.  I felt disgusted and á thought to myself that he could only do this because I was a á woman.,disgust
I was most disgusted when I had to make a nagging three day á journey recently from Calcutta to Bombay.  It was very boring and á tiring.,disgust
[ The previous incident holds good here also.],disgust
"This is an incident that many of us witness in our everyday life á in a city like Bombay.  One day I was travelling by bus, three á men dragged two fellows out of the bus.  Once outside they were á beaten into pulp.  These two fellows, who got beaten, were pick-pockets á and they were being beaten by all and sundry.  I thought to á myself -\what is life?\"".  It is one hell of a place where á",disgust
"We had come back from a programme and we were all (three girls)    á staying over at another girls placce.  One of them started á passing very nasty and outright bitchy remarks at me.  It was á brought on by a male colleague's compliments to me, this girl was á herself interested in this guy.  Bitchiness and catty remarks á made by women never fail to disgust me.  I can particularly á remember this incident as she knew that I had not encouraged the  á guy.",disgust
[ No response.],disgust
When I heard that a 14 years old girl had been raped by four á rikshaw drivers in our town.,disgust
"My classmate at TISS has the habit of biting his nails and ever á since my childhood I have never liked this habit.  This person is á near me in class, dining hall and the campus so I suggested that á he should stop biting his nails.  However he found it difficult á and my disgust feelings have not changed.",disgust
"I once got a phone call stating \one of your friend is in jail, á",disgust
"[ This is an everyday feeling.  Many situational events : causes á are unclean and dirty environment, illiteracy, poverty and á neglect of human resources, disgust at the lack of perception on á the part of us ( educated few) for the lack of drive and drive á towards their redemption. ]",disgust
I feel disgusted since I am unable to cope with all the wordly á affairs as I spend much precious time to pursue my hobby and á to be admist the people I love and long to be with.,disgust
"In Punjab, when in the name of religion people killed each other á during the agitation.",disgust
"Students on campus were unnecessarily creating trouble just to á heckle the authorities - not to achieve something concrete, but á to further their own interest.",disgust
"Yesterday, I was just about to cross the road when a country guy á who was ahead of me spat out a mouthful of betel juice on the á road.  It was very windy and had I not checked my speed I would á have had a very good shower of his saliva.  Though I was not á angry, I felt that these people were very indecent.",disgust
When I could not attend the college picnic due to some á difficulties.,disgust
"One day, at an important place I met a group of girls and while á we were waiting for a bus these girls started smoking and á commanded me to smoke; I felt very disgusted. ",disgust
[ Never experienced.],disgust
"Once when I was studying for my examination, I was asked to do á some work which was unavoidable.",disgust
[ No response.],disgust
"After my +2, when I did not get admission in B.E I felt disgusted.",disgust
My elder sister forced me to do a few things which I did not like á to do.,disgust
I felt disgusted when I was in a helpless position at the loss of á my fiancee.,disgust
"[ There have been very few instances of disgust, as far as I can á remember they are not important or worth mentioning.]",disgust
"Four weeks ago I felt very much touched to find an asciatic á patient who had asked the very morning to be tapped of the fluid, á dying in the evening. I was really disgusted because this was the á Medical staff's negligence. Had the Clinical officers done á something that very morning he might have been alive today.",disgust
I had experienced odd moments one time when a patient came into á the Ward in which I was working. The patient was badly burnt in á the right side of her body. I was very nervous at the sight.,disgust
The first day I visited the hospital I was disgusted because I á experienced offensive smell which I never expected. I nearly ran á away from the course.,disgust
When mum had beaten my young sister just because she had received á a letter from a boyfriend.,disgust
"The time when I cleaned the house and everything was tidy, á then my cousin, who is 4 years old, came with a muddy pot and made á a mess of the whole thing.",disgust
Bad temper of the serving lady in the students' dining hall.,disgust
Saw a dirty street.,disgust
Someone not responding to my criticism.,disgust
Finding out that old and useless practitioners of retirement age á will go to your English lectures and they do not understand á English.,disgust
Saw a real party leader.,disgust
Saw my class leader acting like a God when he chose people to go á to your English lectures.,disgust
Hear people talking at my back.,disgust
"I was disgusted at myself when I dropped a vital catch, while á playing a cricket match, and we lost the match; though the catch á was difficult. ",disgust
[ No response.],disgust
"When I opted for my research field, for them the percentage of á marks was more important than my knowledge.",disgust
[ When mix was coming from column for several days.],disgust
"[ Honestly, I have never felt disgust at any situation in my á life.]",disgust
I was disgusted when our cricket team manager dropped me from the á team.,disgust
When I lost the notes of the lecturer I had borrowed from my á friend.,disgust
There was a family fight in my house some time back.  My uncle á had given me a watch as a present and I lost it.  During the á fight he accused me of having sold the watch.  I was disgusted at á his false accusations.,disgust
"A railways officer, when asked by the ticket checker to produce á his tickets, got very aggressive and started abusing and using á his authority in a very wrong way.",disgust
"When Kanishka was blown up, I really felt disgusted at people á killing each other.",disgust
[ Do not remember any incident.],disgust
I felt the emotion when I entered a certain ward in the hospital á to visit my relative who was sick.,disgust
"One of my best friends was found lying flat on the road because á he was drunk and was taken by the police and put in a cell. I á went to see him the following morning, the place was really a á mess and was smelling badly. I didn't like it.",disgust
In Ward 1A was an epileptic patient who was burnt the whole body á and was stinking very much such that the whole ward was affected. á Few people could come near him.,disgust
"The time I went to see one of my girlfriends at Area 18 I found á that she was not there but in the room she was sleeping, in the same á room there were some women visitors with children so the room was á smelling very badly with some faeces and urine in it so I didn't stay á any longer.",disgust
I was disgusted with my girlfriend's behaviour. She was going out á with other boys who were also my friends.,disgust
I was disgusted with the behaviour of one of my fellow students á during my Secondary School life. He was a habitual noise-maker á and caused great conflicts with the teachers.,disgust
The emotion came to me when a certain girl who was not polite to á her mother hit her sister severely.,disgust
This situation occurred when I entered into a smelling ward.,disgust
I felt disgusted when a certain lady spoke words of sarcasm when á I was trying to propose to her.,disgust
I was double crossing Mercy and Maria. They one day came to know á each other. I was found by Mercy red-haded when I was with Maria.,disgust
I was disgusted when my brother was arrested because of stealing á money.,disgust
When I was presumed to have stolen maize from the school garden.,disgust
When I entered the wound intensive care at the Central Hospital á in Blantyre which was stinking.,disgust
I felt disgust when I saw a friend walking in stagnant water á without putting on gum boots.,disgust
I was disgusted to see a person vomitting and I was told to clean á the place where the vomit was.,disgust
A sister broke a cup and when mother asked I was reported to have á been responsible.,disgust
"I was disgusted when I was told to dress a big rotten stinky á wound which, coming closer, made me feel like vomitting.",disgust
"My first day to work in hospital, when I was dressing wounds I á was disgusted when I came across one wound with a very bad smell.",disgust
It was when my father beat my mother while she was ill for three á weeks and now she was recovering.,disgust
One of those days when I was going to school with my brother and á he annoyed me.,disgust
A condition in which I was disgusted followed when I lost money á on my way home from the college.,disgust
It was when I drunk urine during my childhood thinking it was á water. My friend had urinated in the tin.,disgust
I felt disgusted when I went to one of the Central hospitals á where my hope of getting good treatment was turned down by one of á the doctors who said I was alright despite my feeling pain.,disgust
When I vomitted a lump of blood.,disgust
I was really disgusted when I saw one of my friends soiling on á his clothes. I thought he was mad.,disgust
In ward 2A there was a patient suffering from Syphilitic á Paraplegia and had pressure sores. The wounds had offensive smell á that only a few people .... the place.,disgust
In May somebody blamed me that I made him to be caught while á peeping during the Nursing Test which made me feel disgusted.,disgust
I was stopped from entering a party while I was at School but I á had an Invitation card with me. This was done because they said I á was too young to join elderly people.,disgust
When somebody made me touch human faeces.,disgust
One time at the hospital I passed near the intensive care room. á The offensive smell that came out disgusted me in such a way that á I didn't even dare to enter the room.,disgust
I was dancing Malipenga (traditional dance). I exaggerated the á steps I was supposed to make in the negative way. This happened in á front of spectators. It was bad for our Boma (group) because I á was on the front line where ability is displayed and it is this á ability that counts when choosing the winning side.,disgust
"I felt disgust when I received visitors at an odd hour. I was á seriously preparing for Examinations, so I did not appreciate á their coming.",disgust
"It happened that one of my best friends just took my shirt á without my knowledge, I hadn't put it on for many days and I was á short of clothes.",disgust
"After buying a ticket, I lost it before I reached my destination á and the bus Inspector dropped me at a place I didn't know.",disgust
When a boy whom I refused to be my lover told all his friends á that I was his girl he has refused me because I was not faithful á to him.,disgust
I felt disgusted when I was not given money for lunch at school á by my father as a punishment for beating my little brother.,disgust
My friend promised to take me out for a movie but he didn't turn á up.,disgust
I went to a party and there were some cakes which weren't good á and had a bad smell.,disgust
I saw a program on T.V where they had to saw a skull for an        á operation.,disgust
I felt disgusted when my cousin decided that she would stop á going to school saying she wanted to get married. She was only 14 á years by then and she didn't understand what she was thinking.,disgust
"I was disgusted with my brother's behaviour when he kept throwing á things away because of his anger, after mum had shouted at him.",disgust
"In my village there was this tax collector who used to cheat á people and collected more than was wanted, the surplus was for á his family and himself.",disgust
When my fellow classmates were involved in a quarrel.,disgust
I felt disgusted when my appointment to meet the E.N.T. á specialist had been turned down. The specialist came from U.K. á and went the same day and we do not have one.,disgust
I went to a party with my boyfriend who got so drunk and started á vomiting. It was so disgusting.,disgust
I received a letter which was too strong for me. It said I had á done something which I really didn't do.,disgust
"I felt disgusted one day when, as we were eating, a child á defecated on the table side.",disgust
When I was a child I broke plates because I wasn't given food on á the grounds of coming home late.,disgust
I felt disgusted when somebody told me that my previous boyfriend á was her boyfriend.,disgust
"I saw a septic, smelling wound.",disgust
One day I was walking with my boyfriend. We met my ex-boyfriend á and out of jealousy he started calling me names.,disgust
"I felt this situation when a certain woman from a close village á shouted at my mother because she didn't get what she wanted, she á wanted some salt to put in her relish.",disgust
One day my friend told me that she had heard that I was moving á about with her boyfriend. I was disgusted with the news.,disgust
"Once I offended a friend, instead of her coming to me to ask and á discuss the matter she was just telling other people about it and á say all she could about me.",disgust
"The carterer refused to give me sugar to add to my tea saying á that there was no sugar whilst it was there, so I left the cafe á disgusted without taking the tea.",disgust
When I boarded Yanu Yanu bus I sat near a man who was smoking á tobacco.,disgust
I was disgusted the other day I was told to take off the dog's á faeces around the house since they smelled bad I did the job but á in the end I felt disgusted.,disgust
When a boy I hated most in our classroom took my T Jersey from my á desk and put it on.,disgust
I met a certain lady at the bus depot who was using a bad á language but was a very smart looking lady.,disgust
I was very disgusted the first day I went to put a dead body in á the Mortuary. There were many dead bodies and some were uncovered á so we had to put on top of the other bodies.,disgust
I was disgusted when my little sister had been hit badly by her á friends.,disgust
I was forced to go to a party with someone I didn't love and he á was telling people that I was his girlfriend.,disgust
I was told I shouldn't visit my sister because the holiday was á short.,disgust
"When I saw a lady putting on a pair of trousers, I felt it was a á disguise according to Malawi culture.",disgust
I felt disgust when I saw a drunkard vomiting very offensive á matter.,disgust
Somebody went around spreading news that I like people with á money.,disgust
"My father promised to send me pocket money at the month-end since á I wanted to buy a new pair of shoes when I was at secondary á school, but he didn't.",disgust
Given duty by the leaders which I do not like to do.,disgust
Class leader told me to collect homework for him.,disgust
People not cueing in the college dining room.,disgust
"Waiting for a bus not coming for a long time, and the bus drivers á were having a long lunch.",disgust
Saw my roommate messing up our room.,disgust
Saw my brother-in-law insulting my sister.,disgust
The serving lady in the students' dining hall shouting at á studennts.,disgust
Class leader getting me to do things he did not want to do.,disgust
A girl I do not like kept coming to me and talking to me.,disgust
When I was the South Koreans on the TV.,disgust
Some foreign students playing loud music late at night.,disgust
A woman picked her nose and spit right next to me.,disgust
A boy in my class talking too loud in the lecture.,disgust
Getting into a crowded bus.,disgust
Cueing in the students dining hall.,disgust
Doing this pointless questionnaire.,disgust
Someone I do not like kept talking to me.,disgust
Some students talking when other people are having a nap.,disgust
Saw my father with that woman he is married to now.,disgust
Saw someone messing up our room.,disgust
"Finding out that the class leader can go to your lectures, and á his English is worse than mine.",disgust
Heard some postgraduate students talking about girls being á unsiutable to do medicine.,disgust
Saw someone spitting in public.,disgust
Some boys not cueing in the dining hall.,disgust
Saw some girls dressed up like Americans,disgust
Foreign students playing loud music in the night before the á biology examn.,disgust
Saw Chinese people flattering foreigners.,disgust
Girls dressed like foreigners in the university.,disgust
Finding out that my best friend was deceiving me.,disgust
Saw people quarreling in a bus.,disgust
Saw people spitting in public.,disgust
Someone being arrogant to me.,disgust
Someone told me he was chosen for the English lectures because he á was a good friend of the class leader.,disgust
Saw a man dressed as a woman.,disgust
Saw a very arrogant girl walking like a queen.,disgust
Saw someone who picked up a cigarette from the floor and smoked á it.,disgust
Saw someone licking his dining bowl.,disgust
Saw an arrogant girl walking pass by.,disgust
Cueing for a bus and the drivers having long dinner.,disgust
Someone I know and respect sexually assulted a girl.,disgust
Someone had stolen an article from a library journal.,disgust
My roommate's lack of consideration of me.,disgust
My roommate boasting about her English lectures.,disgust
Finding out that some students are getting good reports they do á not deserve.,disgust
Someone told me I was chosen for the English lectures because I á am good looking.,disgust
Saw a mate bribing the leader.,disgust
Some students whose English is worse than mine can go to your á lectures (English lectures).,disgust
Saw someone acting in a false manner in public.,disgust
Some students deliberately disobey me as a class leader.,disgust
Someone acting stupid in public.,disgust
Being looked at by someone I do not like.,disgust
Saw a selfish person doing a selfish thing.,disgust
Some people not cueing in the dining hall.,disgust
Heard someone boasting his fortune telling and I knew he was á lying.,disgust
Listening to my roommate boasting about her new clothes.,disgust
A wurm dropped on my head.,disgust
My roommate messing up our room.,disgust
My roommate being nice to a party leader in order to get into the á party.,disgust
Saw two Canadian students boasting about how rich they are in á Canada.,disgust
My roommate talking and shaking her bed at night.,disgust
Some boys boasting about their ability to tell dirty jokes.,disgust
Finding out some people had been talking about me at my back. ,disgust
Talking to someone I disliked.,disgust
A relative not acting on her promise.,disgust
Postgraduate students talking about girls stupid.,disgust
I had been forced to get together with strange and disgusting á classmates.  The things they talked about disgusted me and made á me feel ill at ease.  I knew that I would feel unhappy if I á stayed there but I was defeated by the social norms.,disgust
"Someone, who was sitting very close to me, was smoknig in the á compartment of an air conditioned mini-bus.",disgust
Because of the examination I had to study night and day.,disgust
I greeted a friend and he did not respond.,disgust
"I was sitting in the bus and a man with a very unpleasant á smell came and sat next to me, to top it all he smoked á continously.",disgust
"When I was talking to a person who is a hypocrite, I felt á disgusted at his reaction.",disgust
"Once when I had started to write a paper, there was a phone á call for me.  I had to go downstairs to receive it and after the á conversation I discovered that all the information had á disappeared from my mind.",disgust
Knowing that I had to do the survey with him I felt very á reluctant.  Although I do not know him I feel disgusted by just á looking at him.  Thinking that the project lasted several days I á regreted having joined that project.,disgust
"When I dined with my new friends, one of them kept reminding us á that he was superior.",disgust
During the Chinese lessons a student often showed off. Moreover á he misbehaved and dressed very badly.  So disgusting !,disgust
"One day when I was sitting in a not very crowded bus, a middle  á aged woman was standing beside me.  The person sitting next to me á got up to get off and this woman pushed me and occupied the seat. á  Then she took off her shoes and put her feet on the seat.",disgust
"I am disgusted by people who spoil their identity because of á misbehaviour.  This morning when I was in a crowded bus, I found á a seat on which a university student was sitting on one side and á he had put his bag and files next to him.  There was very little á space left and I sat down while he kept on reading.  Even when I á leaned on him he did not put his bag away.  He did not respond and á I felt very angry.",disgust
In secondary school I had a class-mate who talked too much.   á Once we went to the cinema after school and she sat next to me and á commented the movie throughout  - very disgusting.,disgust
I felt disgusted on seeing my boyfriend after our separation.  á One day he was begging at the mass transit railway station and at á that moment I hated him.,disgust
"I was an instructior in a youth organization.  Whenever we, the á instructors would have a meeting the advisor would be present.  á He did not understand our worknig conditions but talked a lot á and had a lot of outdated ideas.  Whenever we disagreed with him á he was very discontent and said that we had a prejudice against á him.  Why did he have to treat us as his subordinates ?",disgust
My girlfriend lost her temper without any reason and she did not á consider or respect my feelings.,disgust
"I hate the behaviour of my so called friends, they use bad á language, spit, boast and treat the youngsters badly.",disgust
"When I was a teacher in an evening school, a girl raised a lot of á questions and expressed her opinions.  She, very often, took a á stand which was different from mine and she thought that it á was better than mine.  Her opinions were helpful academically, but  á she did not take into consideration my position in public.  Also á she seemed to be very talkative and so she disgusted me.",disgust
"When I was travelling to school by bus, I went past a place á where a sewer had been repaired.  There was a bad strong smell á which suffocated me and I wanted to leave the place immediately.",disgust
At the crowded conditions of living.  I always quarrel with my á elder brother as he puts the T.V volume at a deafening level and á I can not practise my piano lessons.  Thus I feel that my home is á disgusting.,disgust
When I was giving private tutorials to my student; he would not á concentrate and was lazy.  He had not done the home work that I  á had assigned and his academic level was very low.  It was a á nuisance.,disgust
When I was studying and someone disturbed me.,disgust
"Our neighbour came and gossiped, about others, with my parents.",disgust
"During a recent meeting, Mr. A showed his excitement and á overindulged in the notes delivered.  Though his curiosity could á not be blamed, his way of accquiring knowledge was an extreme á behaviour e.g he always tried to know what I was reading and á gained everything he could.",disgust
When the summer holiday job was almost over.,disgust
The behaviour of people spitting everywhere.,disgust
It was a narrow and dirty passage which was located near the á market and I had to stand there to wait for people.,disgust
"In a study group, a person always liked to argue on some á unimportant, irrelevant and minor points.  He tried to persuade    á others in an unfriendly way.  He was obstinate and would not accept  á other's point of view.",disgust
"My classmate got a \B\"" for his homework while I only got a \""C\"".  á",disgust
A  group of youngsters dressed in fads talked foul language on a á bus.  They also insulted the  pedestrians on the road and were á impolite to the passengers of the bus.,disgust
A tiresome person held me up all day long.  I was very busy then á (I can not remember what the problem was).  He continously tried á to make me talk to him and disturbed me.,disgust
When I saw a lot of rubbish and animal waste on the floor.,disgust
Once while studying for my exam I found so many complicated words á that it disgusted me.,disgust
"[ I would classify subjectively, a certain gesture or the way of á talking of a person as disgusting or inacceptable.]",disgust
"I used to play with a group of classmates and I found out later á that they were cheap in thought, behaviour and conduct - they á would smoke, fight and speak foul language.  I thought that they á destroyed the image of college students.",disgust
When I was studying in the library a pair of lovers were sitting á next to me talking in an intense and soft voice.  They were á disturbing others.,disgust
My boyfriend and I did not have any contact with each other during  á the Summer holidays.  I met him the day of the registration and looked  á through him.  In the canteen he asked me if I wanted to have a drink and  á I said no as I did not want him to do me a favour.,disgust
A brother from one of the Christian fellowship often phoned me á and talked to me for half an hour or more.  However there was á nothing important in the conversation and I found the person very á disgusting.,disgust
"My mother was always fastidious about my room, bed time, etc.  á She treated us strictly and punished us physically.   These á things were intolerable.",disgust
Once at a camp a classmate criticized me in front of others.  Now á I find that this classmate is very disgusting.,disgust
