"I went out with my sister, her boyfriend and his friend. I did á not like this young man. But suddenly he overcame me and kissed á me. He was very strong so that I could not defend myself.",disgust
When I was molested by an old drunk man.,disgust
At the butcher's I saw an animal which had just been slaughtered; á blood was dripping on the floor.,disgust
"When I attended school, our class visited an institution for á mentally and physically handicapped persons. Although I tried to á control my feelings, I was disgusted.",disgust
"At a party I met a girl who drew me to her, told me some nonsense á and always wanted to kiss me.",disgust
I was sitting in a station-hall and watching a lavatory á attendant. She was very dirty. She started to eat something out á of a dirty cup - it must have been something like lard. Then she á took some breadcrumbs out of the pockets of her apron and ate á them. I had to leave - I felt like vomitting. ,disgust
"When I watched a report about El Salvador on TV, I saw people who á had been murdered by terrible methods.",disgust
I studied medicine for several semesters. I was always disgusted á when we had the dissecting-course. I cannot understand why some á persons like this course.,disgust
On my way to a concert I went with a man who tried to molest me. á At that moment I did not care much but now the impression fills á me with disgust.,disgust
"A man whom I like, was drunk and tried to molest me.",disgust
"A friend of mine was telling jokes which I felt to be very á disgusting, especially because I was eating.",disgust
Several years ago I stayed with friends in the mountains for one á week. We lived in a hut and had to cook for ourselves. One day my á friend did not succeed in preparing spaghetti. That dinner was á terrible - nevertheless we all ate rather much and had an á improper and unsavoury conversation.,disgust
Whenever I see a spider or a snake I feel disgusted.,disgust
On TV I saw a report about church in Amerika. A priest was shown á who was performing miracles in front of the camera - I felt á disgusted.,disgust
When a very near person got into an awkward situation but showed á only helplessness and indecision.,disgust
When I got indecent offers.,disgust
In cinema I saw a film which showed how a person was torn out his á guts when he was still alive.,disgust
"Normally my father never tells vulgar jokes, we do not speak á about sexual things, too. But once he told such a vulgar joke, á that I was really disgusted. He did not tell me, but some of his á friends, but I was present.",disgust
"I had a quarrel with a friend who lived with me in the same flat. á He moved out. Before he went he invited me and some friends for a á drink. At last he was totally drunk and smelled disgusting. á Besides, he told lies about us and behaved as if he was to be á pitied.",disgust
I was insulted without a reason by a drunk man.,disgust
"When my grandmother was about 80 years old, she lived with us for á several years. I saw her illness. I did not even want to breath á the air that smelled of her presence.",disgust
"When I was a child, I was sometimes forced to eat things that á disgusted me.",disgust
"After a pleasant evening with friends in my flat, one of them did á not want to leave, because he wanted to sleep with me. He said á that he had fallen in love with me, that he felt alone and so on.",disgust
When I worked at the life-saving sevice and saw the first exitus.,disgust
"When I was in the army, we got a certain dish for dinner that I á do not like at all. We were not obliged to eat, but I was very á hungry.",disgust
When I worked at the life-saving service I was disgusted by a á patient whose outward appearance was distasteful.,disgust
I read about a murderer who brutalized his victims by cutting á open their stomaches and taking out their bowels.,disgust
"When I was walking on the street, I slipped on the dung of a dog. á I did not fall down, but I felt disgusted by the bad smell on my á sole.",disgust
A drunk man bumped into me and wanted to grip me. Fortunately I á was able to break loose.,disgust
I saw a drunk man tottering behind his wife and insulting her á awfully.,disgust
"On my way home in the middle of the night I saw a drunk man and a á woman who were quarreling, beating each other, shouting and so á on. I felt disgusted especially because they treated each other á in such a degrading way.",disgust
At a party I saw two persons having a fight. The aggressions and á the hate between these persons produced an unpleasant impression á on me.,disgust
When I heard about a murder of a 16-year-old girl.,disgust
"3 years ago I served in the army. Once a collegue denounced me á because of a delict, which is usually committed. I was arrested á for 3 days. I still detest this man.",disgust
"I think I have hardly had a situation where I felt disgusted. á Perhaps once, when I saw a big spider.",disgust
Accidentally seeing a friend in a compromising situation with a á stranger.,disgust
The price I was charged for work on my car.,disgust
"A friend once reacted childishly (he is 23 yearrs old) to my not á responding in his favour to a request, that is: he asked me for á some money I refused, and his reaction was quite childish.",disgust
At a social event when none of the guests would help to serve á food or clear tables. It was all beneath them.,disgust
"A colleague and I were sitting on a bench next to an old man in a á shopping centre. the old man coughed and spluttered somewhat, á then with his fingers removed the resultant phlegm and mucous á from his mouth, and transferred it onto the armrest of the á bench.",disgust
"When I heard about the way a parent of a friend had mistreated á him, and caused a great instability.",disgust
Disgust at a girl I know for continually feeling sorry for herself á and never acting positively to do something about her problems.,disgust
"I realised that someone was insidiously attempting to shit me off á I was disgusted with him for doing so, because I afforded him á with no excuse to do so.",disgust
Disgust with myself for consistently making foolish errors in á communicating with others (asking for 1/2 Kg of nuts when I only á wanted 50 g).,disgust
I discovered some pornographic literature in a workmates drawers. á The literature featured pictures of naked women defecating on one á another.,disgust
"A girl with whom I was staying having sex with a person for about á 3 nights running, and then with his brother the following night, á and back again.",disgust
Disgust with oneself after being intoxicated enough to go to bed á with a stranger.,disgust
When my father revealed inconsistent morals.,disgust
A lecturer in great detail spoke about his sexual experiences.,disgust
"Viewing the nuclear war film \Threads\"".""",disgust
When I became aware that an acquaintance had stolen from friends.,disgust
A female friend was violently ill on the return journey from a á wedding reception we attended. Getting her out of the car when á home took quite a while.,disgust
When after a party celebrating a friend's 21st birthday - upon á leaving I found 10 people outside throwing up and further 4 á unconscious.,disgust
"We had friends to dinner and one of them threw a beer bottle in á the air, and it bounced on an expensive table and damaged the á table .The person did not apologise.",disgust
"Discovering a good friend had lied to me, resulting in a á detrimental relationship with another person.",disgust
When I found out some family friends were embezzelling the á company they worked for - using company petrol and food supplies á and claiming furniture and crockery.,disgust
Someone ruining someone's property just for the fun of it.,disgust
Was picking up my father from work and on passing through the á Valley watched three prostitutes walk up and down waiting for á someone to pick them up. Clothing was disgusting.,disgust
"When I heard that one of my good friends, when at a party, had á got herself involved with some very undesirable characters and á was experimenting with drugs.",disgust
"While watching a film of an experimental operation on a cat's á brain in which the cat had metal pieces protruding from its eyes, á mouth etc. to keep the head stable while being cut open.",disgust
"At school, when the only thing people my age could think of was getting á rolling drunk. They couldn't have a good time without firstly á getting drunk.",disgust
"During the PY 102 film session on Tuesday, one of the films shown  á was of an experiment on a live cat involving strapping it into a á machine for possibly days, and doing things to its brain.",disgust
At a party where the boys were telling revolting stories about á the girls they'd been with.,disgust
"At my father, when he yelled and accused my sister's friend (over á the phone) of doing something he didn't do, or know anything á about.",disgust
A situation where I ignored my beliefs and principles for a trip á of whimsy.,disgust
Hearing of a filthy situation over the phone.,disgust
At a night club watching little tarts trying to earn a living.,disgust
When I have seen people very drunk and making fools of á themselves.,disgust
"When walking along the beach with my boyfriend, we saw 2 people á having sex on the sand dunes in full view of everyone. It was the á fact that they chose that area in which to have sex, that á disgusted me.",disgust
"I stayed at the Coast for a weekend with friends. My brother came á to drive me home, but was rude, and in a hurry to rejoin his á friends. I was embarrassed because the family involved was á extremely nice, and hospitable to him.",disgust
When I saw a male engineer one year and came back to find he was á now a female (I don't know it/them personally).,disgust
Person talking about a situation while eating.,disgust
"On a camp - boys and girls in one cabin. One guy forced himself á upon another girl and was having intercourse, while the girl in á the bunk beneath was pretending to be asleep and not be ill.",disgust
"Doctors ignored relative who complained about pain, and is now á dying of cancer.",disgust
A person that eat half of a cockroach in a cake without knowing á it.,disgust
To be kissed by soembody I didn't expect to.,disgust
When I see all the putridness of people. The fact is the catarrh á and spits that whash the streets of S.Paulo.,disgust
To go through the underground way at suburb station of LAPA. Poor á people and the ambulants badly dressed up in a passage badly á kept.,disgust
"A dirty person, smelling bad and unknown laying on me.",disgust
An acquaintance of mine revealed himself in a light unexpected to á me.,disgust
"When I was watching some scenes from the Bertoluchi's film á \Twentieth Century\"".""",disgust
When I happen to witness some sadistic acts.,disgust
I was on a walk with my child when I met a drunk woman.,disgust
Disgust with a subordinate.,disgust
Someone smoking on Electric train (Electric trains are á non-smoking) with alcohol smell coming from person.  ,disgust
"When one of my parents verbally, personally abused the other.",disgust
Being in a Malaysian city with my girlfriend coming out of a á picture theatre - seeing her rush up to a taxi that a very old á sick man was trying to get to. Seeing her take over the taxi.,disgust
When a friend didn't invite her own parents to her Graduation á ceremony.,disgust
"I was sitting at a rock concert, listening to an extremely loud á band. A tiny baby in a crawler had been left by his young mother, á right out in the sun next to a speaker, and was screaming - á probably in pain.",disgust
"One of my flatmates and I came back to the flat Monday morning, á to find a real Mess, left by the guy we share with.",disgust
I have an adopted Aboriginal sister I felt disgust due to the á racism she has been subjected to.,disgust
"When I discovered my mother had been having an affair with my á father's best friend, and then ran away with him without even á speaking to me about what she was doing letting me come home from á school simply to find her gone. I was filled with disgust and á contempt.",disgust
Viewing the results of senseless vandalism to a local primary á school.,disgust
"When I found out how the people of Ethiopia were starving and á their government was spending millions on celebrating being in á power so many years. Then I saw all these people on TV needing á food, etc.",disgust
Returning home in the late afternoon I saw an indecent act made á by a man with the purpose that I saw it.,disgust
I went to a restaurant with my boyfriend for dinner. There we saw á a couple. the man of the couple was a negro and he hadn't manners á for eat.,disgust
A teacher giving a test was called by a student by his first á name. He (the teacher) said that he didn't give him this liberty.,disgust
I felt disgust of dirty.,disgust
When I red a report in the magazine VESA about an Iranian telling á what she had lived in the prisons in Iran. I felt disgust about á that people.,disgust
"I had this feeling when I met a girl, not that she was dirty but á she was to \fresh\"", dump and childish.""",disgust
I felt disgust of my father when I knew he had a lover.,disgust
Disgust of drunkers and of blood.,disgust
"When my friends and I were camping in a weekend, and with little á food, we met a middle age couple from a small town that invited á us to eat in their house. Their house was small, badly built with á old and dirty forniture and utensils. The problem was with pans, á and dishes, and even the food.",disgust
When I went in a clinical hospital and saw in what conditions á people are attended there.,disgust
"When some friends and I get acquainted a guy during vacations I á thought he was disgusted and \a friend\"" of mine for whom I feel a á",disgust
When a girl that I liked didn't accept my curting.,disgust
"I met a girl (22 years old), married. I liked her. I asked her á for a date and I kissed her. I discovered that she lived nearby á where I passed every day. I got amused thinking that her husband á would be ... or me . I didn't talked to her anymore.",disgust
In contact with a poor family of northeast it was offered to me a á crab to eat at my request. But the fact that this crab was á prepared antihygienically and his appearence was also á antihygienically it caused me disgust but I ate it anyway.,disgust
"When I knew that a person who I didn't like, had about me other á feelings.",disgust
After a serie of facts that occurred between a colleague and me I á started to feel a certain necessity to get apart and I didn't want á to see her anymore.,disgust
"I was sitting in school, waiting for my sister to go home. Suddenly a á boy put fire in a paper and threw it were I was sitting. The á paper didn't get me, but I felt terribly disgusted at this á cowardliness and irresponsibility that caused a great á discussion. We went to the director and he, drunk as always, said á that I was ... attention in school. I felt disgust of this á situation, and of the persons implicated in it.",disgust
"There is a girl at my work that doesn't take care much of her á hygiene she comes always with her hair oiled, a not very agreable á smell, and a bad appearance. Beside this she tries to be nice.",disgust
I felt disgust toward meat when I felt sick with the steak after á a week only on meat.,disgust
When I felt the smell of industries that pollute.,disgust
"I was travelling, we were 15 person, one of them I met at the á travel and didn't like her. One night I was asleep while she and á her friends were talking too loud in the kitchen. I got up to ask for á silence and since that day I felt constant disgust for her.",disgust
In a certain occasion I saw a dog in the street eating something á so strange gooey that I wasn't able to eat lunch because I á remembered the scene all the time.,disgust
I saw a film where snakes were crawling everywhere. I felt them á crawling over all my body with that ... skins. The noise that á they did disturbed me very much.,disgust
When my oldest sister discovered that her boyfriend had another á girl.,disgust
When I watched a film about the problems of abandoned children á (PIXOTE).,disgust
"The same event described under FEAR - in the bus a man sat beside á me, with his trousers open and holding his penis.",disgust
When somebody despised a friend of mine.,disgust
To see damaged lettuce (with worms) in the icebox.,disgust
"I felt disgust about all my friends. After having done a great á effort to organize an evening together, and didn't work out, they á put the blame on me. After this, I feel disgust towards those that á blame me.",disgust
When I had to plunge in a swamp of fetid and stagnant water.,disgust
"I felt disgust when I realized that I had eaten something fatty, á and vomited too much.",disgust
When I visited a creche. The conditions weren't too precarious á but the children were in conditions of physical and emotional á penury.,disgust
Seeing persons spending money in a shopping center with á completely indifference to the misery reigning in our country.,disgust
About my girlfriend's sister who is a viper as I discovered some á time ago.,disgust
I felt disgust when I saw a dead animal on the roadway.,disgust
"When I saw the film \Memorie of Prison\"" I saw a scene of á",disgust
When I needed another job and tought that a good and known person á (my employer) could help me. He simply said that he couldn't help á me.,disgust
I felt disgust when I kissed a guy that I know. I was on the outs á with my boyfriend and this person appeared but he has nothing to á do with me.,disgust
When I met my boyfriend with another girl.,disgust
"I was returning from the Universtity at night when I was accosted á by a boy who molested me, passing his hands on my body.",disgust
I saw a magazine with photographs of dead and maimed people whose á limbs were separated from their body like a head on one side and á the leg on the other.,disgust
My main disgust is against codfish because I detest even the á smell of it.,disgust
When I saw a man who hadn't the lower .... in a car á exhibition. He was passing a handkerchief from inside to outside á of his mouth.,disgust
When in my childhood we were forced to take cod-liver oil.,disgust
I was working in a classmate's house with a group. A girl began á to graze her foot against mine under the table.,disgust
When I heard the bad news about the death of a close person.,disgust
"I saw a man falling on the walkway. He seemed half dead, and was á immobile. I felt disgust for the people who passed by without á doing anything to help.",disgust
When I saw a fight I had a physical reaction of disgust and of á deep perturbation.,disgust
I went to eat at my aunt's house and she served macaroni with a á horrible appearence. I felt the sensation above. The worst was á that I was practically obliged to eat.,disgust
When the Americans set their nucleaar missiles in Europe.,disgust
I was disgusted with the hypocrisy of my colleagues from the á group.,disgust
"I felt it when I saw a colleague of mine eating like a beast. At á the same time he was making gestures, speaking and making the á hell of a noise.",disgust
"A similar feeling I felt quite recently while travelling in a á taxi. The driver treated me roughly and dishonestly - he chose á the longest route, he overdrawed almost one lev more and he tried á to be intimate with me.",disgust
I found a big black beetle in my coffee cup. It was alive big and á it was moving its limbs.,disgust
A drunk man had fallen in the street and he was shouting obscene á words.,disgust
I caught a glimpse of a black-beetle.,disgust
"I was looking after a dying patient at work one night, a young á woman, my colleague was talking to her relatives and .... to á offer them any support emotionally, physically and then sent them á down to the coffee shop to have a dinner rather than offering the á facilities available for their use cause it involved her having á to do some work. Seeing them again I felt disgusted at her á attitude.",disgust
I was disgusted with a friend's behaviour when she got absolutely á drunk so that she vomitted all over my house.,disgust
We had a birthday party with 5 friends. One of us frequently used á hard drugs. On the party I discovered that the other 3 friends á also used them. While we agreed we would help the big user to á stop using it.,disgust
I felt dusgust with a self-iterested person who ruined the life á of another by means of utterly unfair methods.,disgust
"I felt disgust with the alcohol, after I happened to see a young á man, who was dead to the world and who wallowed on the pavement. á This \sight\"" I watched from the bus.""",disgust
"I am disgusted with my sister's husband. On an early Sunday á morning after having knocked at my door, he suddenly rushed in á and finching me still in bed he began quarrelling about á something. I could not understand. I heard his last words: \Don't á",disgust
"I felt disgust with a man I had trusted and respected, to whose á problems I had always shown deep understanding.",disgust
I am disgusted with the fact that bad singers play at the opera á (and not only there) only because they are protegTs or lovers of á an important felow while at the same time some young and able á singers work in a quite different field of life.,disgust
I felt it when I saw our headmaster blushed ingratiating himself á with high ranking officials.,disgust
"I and my friends got acquainted with a guy from Sofia who turned á out to be gay, but we found that out only after 2 or 3 days.",disgust
Negative statement concerning me of a friend before strangers.,disgust
I have experienced disgust with some people - usually double á dealers.,disgust
"I feel disgusted with toadies, hypocrites, chameleons.",disgust
"I am disgusted with liers, hypocrites, slanderers, flunkeys.",disgust
"I stayed for several weeks with a friend of mine before she moved á to live with her husband. One evening he came drunk and made an á awful scene, which I still remember.",disgust
"Sort of awkward. I'd introduced (a lover) but introduced as a á friend to some members of my family, and my niece Yavanna who's á six was home from school and at Mum's and Dad's and was really á silly and at first it was ok, but it went on and on - yukky pooh! á You eat your snot, etc. and I felt cross she wouldn't stop. But á she had an audience and was in one of those moods. Once I'd á accepted it was something everyone does at time I felt better - á it was partly having my friend there.",disgust
Bus driver driving roughly - old man fell off seat into aisle - á driver wouldn't stop - disgusted with her behaviour.,disgust
Disgust at myself when I stroked a sleeping girl's private parts.,disgust
"4-letter words on a TV programme (Roche) while we were á entertaining \conservative\"" relations who wanted to see the first á",disgust
My girlfriend came home after a business dinner at the most á expensive place in town drunk as a skunk. Whats more she drove á home and couldn't remember doing so. I was disgusted by her state á and her actions.,disgust
"Disgust - no. Maybe it is more precise to say revultion at a worm á or a snake. But I mean it in a social aspect when somebody had á behaved like a scoundrel to you, when by his actions he has made á you change your attitude towards him but I thing this feeling the á way I meant it, is not typical for the people interrelations.",disgust
"When, for example, someone is calumnating.",disgust
I don't remember about a situation when I have experienced this á feeling. Maybe it was when I saw a drunkard in the street.,disgust
Attitude to a related family.,disgust
Encouter with a prostitute.,disgust
When somebody behaves like a scoundrel. Recently a colleague of á mine used the name of another one for his own benefit.,disgust
"At the sight of an insect, such as the black-beetle.",disgust
Such a feeling springs up in me sometimes when I have meals at a á catering establishment. It is a result either of the look of the á food or when watching the way some people eat.,disgust
I saw in the street a man spitting.,disgust
"I have felt this feeling when a person whom I believe and respect, á lied to me.",disgust
I felt disgust with a person whose behaviour was out of the á elementary human norms.,disgust
A colleague of mine asked a lecturer to put him a higher mark in á order to keep his good mards and thus to continue getting a á scholarship for an excellent grade.,disgust
Disgust with drunk people.,disgust
From the cigarette smoke. Usually I feel disgust from it when I á am in a restaurant.,disgust
A striking act of ingratitude at a public vehicle.,disgust
"Recently in the tram, a man ran his fingers over my girlfriend á then over me.",disgust
A man was unfair to a girlfriend of mine.,disgust
"I feel disgust with some people when I see what they are capable á of, including lack of any dignity, when trying to find a seat in á the tram.",disgust
"I was disgusted from a quarrel between two married people, in á which the children were involved as accusers of one of the á parents.",disgust
"At an unworthy behaviour of a man, pettiness, stupidity and á mostly at a philistinism.",disgust
I was looking for an object when I came across a rotten corpse of á a rat.,disgust
"The behaviour of a colleague of mine, which doesn't correspond to á my norms of behaviour.",disgust
A lie on the part of a person close to me.,disgust
I saw a film about the nazi concentration camps during the war. á After the film I felt disgust.,disgust
"Some time ago a man tried to teach me something. \Tried\"" because á",disgust
"I met three drunk boys, almost children, they didn't look like á normal people.",disgust
